nohup: ignoring input
2025-11-10 22:10:01,778 | INFO | ==== main.py started ====
2025-11-10 22:10:01,779 | INFO | Args: {'model': 'gcn', 'epochs': 500, 'batch': 64, 'lr': 0.0001, 'patience': 20, 'seed': 23, 'device': 'cuda:3', 'save_path': None, 'optuna': True, 'trials': 20, 'verbose': True, 'log_file': 'logs/gcn_run.log', 'start_node': 6, 'length_V_H': 8}
[I 2025-11-10 22:10:24,095] A new study created in memory with name: no-name-22c0d932-8ab8-4810-bc78-db6471f47625
2025-11-10 22:10:24,095 | INFO | Optuna study created (direction=minimize). Starting optimize...
Epoch 1/500  train_loss=0.693362  val_f1=0.5010  best_val_f1=0.5010
Epoch 11/500  train_loss=0.693201  val_f1=0.5006  best_val_f1=0.5015
Epoch 21/500  train_loss=0.693204  val_f1=0.5004  best_val_f1=0.5016
Epoch 31/500  train_loss=0.693199  val_f1=0.5013  best_val_f1=0.5018
Epoch 41/500  train_loss=0.693194  val_f1=0.4992  best_val_f1=0.5018
Early stopping triggered
Test F1: 0.5013
[I 2025-11-10 22:19:01,305] Trial 0 finished with value: 0.4982450980392157 and parameters: {'lr': 0.01, 'batch_size': 512, 'gcn_layers': 5, 'gcn_width_l1': 128, 'gcn_width_l2': 128, 'gcn_width_l3': 256, 'gcn_width_l4': 128, 'gcn_width_l5': 224, 'dropout': 0.2}. Best is trial 0 with value: 0.4982450980392157.
Epoch 1/500  train_loss=0.649303  val_f1=0.6112  best_val_f1=0.6112
Epoch 11/500  train_loss=0.622491  val_f1=0.6226  best_val_f1=0.6418
Epoch 21/500  train_loss=0.636308  val_f1=0.5992  best_val_f1=0.6418
Early stopping triggered
Test F1: 0.6420
[I 2025-11-10 22:24:11,496] Trial 1 finished with value: 0.3582205882352941 and parameters: {'lr': 0.01, 'batch_size': 256, 'gcn_layers': 5, 'gcn_width_l1': 192, 'gcn_width_l2': 192, 'gcn_width_l3': 160, 'gcn_width_l4': 224, 'gcn_width_l5': 160, 'dropout': 0.2}. Best is trial 1 with value: 0.3582205882352941.
Epoch 1/500  train_loss=0.634520  val_f1=0.6610  best_val_f1=0.6610
Epoch 11/500  train_loss=0.539997  val_f1=0.7041  best_val_f1=0.7041
Epoch 21/500  train_loss=0.525898  val_f1=0.7254  best_val_f1=0.7254
Epoch 31/500  train_loss=0.518352  val_f1=0.7336  best_val_f1=0.7350
Epoch 41/500  train_loss=0.513108  val_f1=0.7387  best_val_f1=0.7395
Epoch 51/500  train_loss=0.508890  val_f1=0.7431  best_val_f1=0.7436
Epoch 61/500  train_loss=0.505899  val_f1=0.7431  best_val_f1=0.7464
Epoch 71/500  train_loss=0.503702  val_f1=0.7463  best_val_f1=0.7475
Epoch 81/500  train_loss=0.500994  val_f1=0.7457  best_val_f1=0.7496
Epoch 91/500  train_loss=0.499023  val_f1=0.7472  best_val_f1=0.7500
Epoch 101/500  train_loss=0.497699  val_f1=0.7479  best_val_f1=0.7506
Epoch 111/500  train_loss=0.496151  val_f1=0.7486  best_val_f1=0.7506
Early stopping triggered
Test F1: 0.7518
[I 2025-11-10 22:58:55,089] Trial 2 finished with value: 0.2493823529411765 and parameters: {'lr': 0.0001, 'batch_size': 64, 'gcn_layers': 2, 'gcn_width_l1': 96, 'gcn_width_l2': 128, 'dropout': 0.3}. Best is trial 2 with value: 0.2493823529411765.
Epoch 1/500  train_loss=0.666390  val_f1=0.6180  best_val_f1=0.6180
Epoch 11/500  train_loss=0.539648  val_f1=0.7119  best_val_f1=0.7119
Epoch 21/500  train_loss=0.519272  val_f1=0.7282  best_val_f1=0.7301
Epoch 31/500  train_loss=0.509080  val_f1=0.7360  best_val_f1=0.7387
Epoch 41/500  train_loss=0.502690  val_f1=0.7415  best_val_f1=0.7415
Epoch 51/500  train_loss=0.497090  val_f1=0.7447  best_val_f1=0.7452
Epoch 61/500  train_loss=0.493845  val_f1=0.7452  best_val_f1=0.7469
Epoch 71/500  train_loss=0.490085  val_f1=0.7485  best_val_f1=0.7488
Epoch 81/500  train_loss=0.487600  val_f1=0.7460  best_val_f1=0.7503
Epoch 91/500  train_loss=0.485564  val_f1=0.7478  best_val_f1=0.7504
Epoch 101/500  train_loss=0.483250  val_f1=0.7493  best_val_f1=0.7516
Epoch 111/500  train_loss=0.481784  val_f1=0.7485  best_val_f1=0.7516
Early stopping triggered
Test F1: 0.7538
[I 2025-11-10 23:17:15,238] Trial 3 finished with value: 0.2483725490196078 and parameters: {'lr': 0.0001, 'batch_size': 512, 'gcn_layers': 3, 'gcn_width_l1': 256, 'gcn_width_l2': 224, 'gcn_width_l3': 96, 'dropout': 0.2}. Best is trial 3 with value: 0.2483725490196078.
Epoch 1/500  train_loss=0.636104  val_f1=0.6496  best_val_f1=0.6496
Epoch 11/500  train_loss=0.574293  val_f1=0.6697  best_val_f1=0.6697
Epoch 21/500  train_loss=0.566742  val_f1=0.6759  best_val_f1=0.6801
Epoch 31/500  train_loss=0.562321  val_f1=0.6862  best_val_f1=0.6906
Epoch 41/500  train_loss=0.558678  val_f1=0.6915  best_val_f1=0.6946
Epoch 51/500  train_loss=0.555520  val_f1=0.6927  best_val_f1=0.6984
Epoch 61/500  train_loss=0.553605  val_f1=0.6977  best_val_f1=0.7035
Epoch 71/500  train_loss=0.551699  val_f1=0.6962  best_val_f1=0.7056
Epoch 81/500  train_loss=0.551210  val_f1=0.7042  best_val_f1=0.7090
Epoch 91/500  train_loss=0.549874  val_f1=0.7048  best_val_f1=0.7090
Early stopping triggered
Test F1: 0.7092
[I 2025-11-10 23:43:35,631] Trial 4 finished with value: 0.29099019607843135 and parameters: {'lr': 0.001, 'batch_size': 128, 'gcn_layers': 5, 'gcn_width_l1': 224, 'gcn_width_l2': 128, 'gcn_width_l3': 128, 'gcn_width_l4': 128, 'gcn_width_l5': 192, 'dropout': 0.4}. Best is trial 3 with value: 0.2483725490196078.
Epoch 1/500  train_loss=0.595678  val_f1=0.6630  best_val_f1=0.6630
Epoch 11/500  train_loss=0.533548  val_f1=0.7083  best_val_f1=0.7083
Epoch 21/500  train_loss=0.522149  val_f1=0.7244  best_val_f1=0.7244
Epoch 31/500  train_loss=0.515109  val_f1=0.7240  best_val_f1=0.7290
Epoch 41/500  train_loss=0.512169  val_f1=0.7281  best_val_f1=0.7313
Epoch 51/500  train_loss=0.509976  val_f1=0.7297  best_val_f1=0.7324
Epoch 61/500  train_loss=0.508509  val_f1=0.7296  best_val_f1=0.7335
Epoch 71/500  train_loss=0.507377  val_f1=0.7316  best_val_f1=0.7343
Epoch 81/500  train_loss=0.506091  val_f1=0.7261  best_val_f1=0.7358
Epoch 91/500  train_loss=0.504899  val_f1=0.7362  best_val_f1=0.7362
Epoch 101/500  train_loss=0.504523  val_f1=0.7317  best_val_f1=0.7397
Epoch 111/500  train_loss=0.504759  val_f1=0.7326  best_val_f1=0.7397
Early stopping triggered
Test F1: 0.7397
[I 2025-11-11 00:31:04,235] Trial 5 finished with value: 0.26030882352941176 and parameters: {'lr': 0.001, 'batch_size': 64, 'gcn_layers': 5, 'gcn_width_l1': 160, 'gcn_width_l2': 224, 'gcn_width_l3': 256, 'gcn_width_l4': 256, 'gcn_width_l5': 256, 'dropout': 0.2}. Best is trial 3 with value: 0.2483725490196078.
Epoch 1/500  train_loss=0.615665  val_f1=0.6756  best_val_f1=0.6756
Epoch 11/500  train_loss=0.541374  val_f1=0.7169  best_val_f1=0.7169
Epoch 21/500  train_loss=0.533747  val_f1=0.7238  best_val_f1=0.7238
Epoch 31/500  train_loss=0.528857  val_f1=0.7235  best_val_f1=0.7272
Epoch 41/500  train_loss=0.526351  val_f1=0.7262  best_val_f1=0.7296
Epoch 51/500  train_loss=0.523926  val_f1=0.7300  best_val_f1=0.7319
Epoch 61/500  train_loss=0.522134  val_f1=0.7329  best_val_f1=0.7342
Epoch 71/500  train_loss=0.520227  val_f1=0.7315  best_val_f1=0.7342
Early stopping triggered
Test F1: 0.7357
[I 2025-11-11 00:48:13,817] Trial 6 finished with value: 0.2657794117647059 and parameters: {'lr': 0.001, 'batch_size': 128, 'gcn_layers': 3, 'gcn_width_l1': 96, 'gcn_width_l2': 96, 'gcn_width_l3': 192, 'dropout': 0.3}. Best is trial 3 with value: 0.2483725490196078.
Epoch 1/500  train_loss=0.615147  val_f1=0.6660  best_val_f1=0.6660
Epoch 11/500  train_loss=0.517659  val_f1=0.7333  best_val_f1=0.7333
Epoch 21/500  train_loss=0.504723  val_f1=0.7411  best_val_f1=0.7411
Epoch 31/500  train_loss=0.497205  val_f1=0.7428  best_val_f1=0.7446
Epoch 41/500  train_loss=0.491888  val_f1=0.7497  best_val_f1=0.7497
Epoch 51/500  train_loss=0.487766  val_f1=0.7532  best_val_f1=0.7532
Epoch 61/500  train_loss=0.485132  val_f1=0.7543  best_val_f1=0.7555
Epoch 71/500  train_loss=0.482991  val_f1=0.7539  best_val_f1=0.7575
Epoch 81/500  train_loss=0.480500  val_f1=0.7562  best_val_f1=0.7575
Early stopping triggered
Test F1: 0.7584
[I 2025-11-11 01:01:24,050] Trial 7 finished with value: 0.24246568627450982 and parameters: {'lr': 0.001, 'batch_size': 512, 'gcn_layers': 2, 'gcn_width_l1': 128, 'gcn_width_l2': 64, 'dropout': 0.2}. Best is trial 7 with value: 0.24246568627450982.
Epoch 1/500  train_loss=0.655330  val_f1=0.6465  best_val_f1=0.6465
Epoch 11/500  train_loss=0.545654  val_f1=0.7067  best_val_f1=0.7069
Epoch 21/500  train_loss=0.531009  val_f1=0.7204  best_val_f1=0.7221
Epoch 31/500  train_loss=0.524030  val_f1=0.7266  best_val_f1=0.7287
Epoch 41/500  train_loss=0.519316  val_f1=0.7310  best_val_f1=0.7310
Epoch 51/500  train_loss=0.515982  val_f1=0.7337  best_val_f1=0.7354
Epoch 61/500  train_loss=0.512945  val_f1=0.7364  best_val_f1=0.7367
Epoch 71/500  train_loss=0.511057  val_f1=0.7361  best_val_f1=0.7379
Epoch 81/500  train_loss=0.509276  val_f1=0.7364  best_val_f1=0.7406
Epoch 91/500  train_loss=0.507515  val_f1=0.7399  best_val_f1=0.7407
Epoch 101/500  train_loss=0.506332  val_f1=0.7400  best_val_f1=0.7425
Epoch 111/500  train_loss=0.504658  val_f1=0.7391  best_val_f1=0.7425
Early stopping triggered
Test F1: 0.7446
[I 2025-11-11 01:31:23,397] Trial 8 finished with value: 0.2575147058823529 and parameters: {'lr': 0.0001, 'batch_size': 128, 'gcn_layers': 4, 'gcn_width_l1': 192, 'gcn_width_l2': 256, 'gcn_width_l3': 96, 'gcn_width_l4': 160, 'dropout': 0.3}. Best is trial 7 with value: 0.24246568627450982.
Epoch 1/500  train_loss=0.662348  val_f1=0.6382  best_val_f1=0.6382
Epoch 11/500  train_loss=0.550656  val_f1=0.6978  best_val_f1=0.6978
Epoch 21/500  train_loss=0.539257  val_f1=0.7074  best_val_f1=0.7074
Epoch 31/500  train_loss=0.531264  val_f1=0.7229  best_val_f1=0.7229
Epoch 41/500  train_loss=0.527235  val_f1=0.7263  best_val_f1=0.7279
Epoch 51/500  train_loss=0.524363  val_f1=0.7314  best_val_f1=0.7314
Epoch 61/500  train_loss=0.521192  val_f1=0.7346  best_val_f1=0.7346
Epoch 71/500  train_loss=0.518937  val_f1=0.7342  best_val_f1=0.7376
Epoch 81/500  train_loss=0.517090  val_f1=0.7394  best_val_f1=0.7394
Epoch 91/500  train_loss=0.514792  val_f1=0.7407  best_val_f1=0.7412
Epoch 101/500  train_loss=0.513177  val_f1=0.7412  best_val_f1=0.7429
Epoch 111/500  train_loss=0.512344  val_f1=0.7411  best_val_f1=0.7445
Epoch 121/500  train_loss=0.510919  val_f1=0.7437  best_val_f1=0.7445
Epoch 131/500  train_loss=0.509114  val_f1=0.7397  best_val_f1=0.7466
Epoch 141/500  train_loss=0.508144  val_f1=0.7398  best_val_f1=0.7466
Epoch 151/500  train_loss=0.507221  val_f1=0.7456  best_val_f1=0.7467
Epoch 161/500  train_loss=0.506892  val_f1=0.7471  best_val_f1=0.7471
Epoch 171/500  train_loss=0.504995  val_f1=0.7422  best_val_f1=0.7477
Epoch 181/500  train_loss=0.504645  val_f1=0.7440  best_val_f1=0.7487
Epoch 191/500  train_loss=0.504546  val_f1=0.7472  best_val_f1=0.7487
Early stopping triggered
Test F1: 0.7506
[I 2025-11-11 02:12:39,253] Trial 9 finished with value: 0.25125490196078426 and parameters: {'lr': 0.0001, 'batch_size': 128, 'gcn_layers': 2, 'gcn_width_l1': 192, 'gcn_width_l2': 128, 'dropout': 0.4}. Best is trial 7 with value: 0.24246568627450982.
Epoch 1/500  train_loss=0.621349  val_f1=0.6682  best_val_f1=0.6682
Epoch 11/500  train_loss=0.517725  val_f1=0.7320  best_val_f1=0.7320
Epoch 21/500  train_loss=0.505563  val_f1=0.7373  best_val_f1=0.7399
Epoch 31/500  train_loss=0.498791  val_f1=0.7483  best_val_f1=0.7483
Epoch 41/500  train_loss=0.494470  val_f1=0.7484  best_val_f1=0.7498
Epoch 51/500  train_loss=0.491781  val_f1=0.7494  best_val_f1=0.7498
Epoch 61/500  train_loss=0.488856  val_f1=0.7479  best_val_f1=0.7520
Epoch 71/500  train_loss=0.486057  val_f1=0.7489  best_val_f1=0.7539
Epoch 81/500  train_loss=0.484295  val_f1=0.7551  best_val_f1=0.7551
Epoch 91/500  train_loss=0.481944  val_f1=0.7500  best_val_f1=0.7555
Epoch 101/500  train_loss=0.480387  val_f1=0.7521  best_val_f1=0.7555
Early stopping triggered
Test F1: 0.7580
[I 2025-11-11 02:27:51,702] Trial 10 finished with value: 0.2444754901960784 and parameters: {'lr': 0.001, 'batch_size': 512, 'gcn_layers': 2, 'gcn_width_l1': 128, 'gcn_width_l2': 64, 'dropout': 0.2}. Best is trial 7 with value: 0.24246568627450982.
Epoch 1/500  train_loss=0.618394  val_f1=0.6701  best_val_f1=0.6701
Epoch 11/500  train_loss=0.516338  val_f1=0.7293  best_val_f1=0.7293
Epoch 21/500  train_loss=0.505108  val_f1=0.7406  best_val_f1=0.7406
Epoch 31/500  train_loss=0.498311  val_f1=0.7443  best_val_f1=0.7452
Epoch 41/500  train_loss=0.493222  val_f1=0.7471  best_val_f1=0.7514
Epoch 51/500  train_loss=0.490461  val_f1=0.7526  best_val_f1=0.7526
Epoch 61/500  train_loss=0.487035  val_f1=0.7470  best_val_f1=0.7544
Epoch 71/500  train_loss=0.484177  val_f1=0.7599  best_val_f1=0.7599
Epoch 81/500  train_loss=0.482204  val_f1=0.7504  best_val_f1=0.7599
Epoch 91/500  train_loss=0.480074  val_f1=0.7547  best_val_f1=0.7599
Early stopping triggered
Test F1: 0.7620
[I 2025-11-11 02:41:19,239] Trial 11 finished with value: 0.24012254901960783 and parameters: {'lr': 0.001, 'batch_size': 512, 'gcn_layers': 2, 'gcn_width_l1': 128, 'gcn_width_l2': 64, 'dropout': 0.2}. Best is trial 11 with value: 0.24012254901960783.
Epoch 1/500  train_loss=0.636334  val_f1=0.6559  best_val_f1=0.6559
Epoch 11/500  train_loss=0.535094  val_f1=0.7191  best_val_f1=0.7191
Epoch 21/500  train_loss=0.525552  val_f1=0.7265  best_val_f1=0.7265
Epoch 31/500  train_loss=0.521131  val_f1=0.7273  best_val_f1=0.7289
Epoch 41/500  train_loss=0.518226  val_f1=0.7366  best_val_f1=0.7366
Epoch 51/500  train_loss=0.515539  val_f1=0.7342  best_val_f1=0.7366
Epoch 61/500  train_loss=0.513352  val_f1=0.7373  best_val_f1=0.7373
Epoch 71/500  train_loss=0.511362  val_f1=0.7347  best_val_f1=0.7377
Epoch 81/500  train_loss=0.509166  val_f1=0.7309  best_val_f1=0.7400
Epoch 91/500  train_loss=0.508215  val_f1=0.7302  best_val_f1=0.7400
Early stopping triggered
Test F1: 0.7413
[I 2025-11-11 02:56:28,816] Trial 12 finished with value: 0.25998529411764704 and parameters: {'lr': 0.001, 'batch_size': 512, 'gcn_layers': 3, 'gcn_width_l1': 64, 'gcn_width_l2': 64, 'gcn_width_l3': 64, 'dropout': 0.2}. Best is trial 11 with value: 0.24012254901960783.
Epoch 1/500  train_loss=0.612511  val_f1=0.6725  best_val_f1=0.6725
Epoch 11/500  train_loss=0.508347  val_f1=0.7337  best_val_f1=0.7350
Epoch 21/500  train_loss=0.496959  val_f1=0.7443  best_val_f1=0.7443
Epoch 31/500  train_loss=0.489701  val_f1=0.7509  best_val_f1=0.7509
Epoch 41/500  train_loss=0.484667  val_f1=0.7519  best_val_f1=0.7547
Epoch 51/500  train_loss=0.481555  val_f1=0.7541  best_val_f1=0.7573
Epoch 61/500  train_loss=0.479362  val_f1=0.7603  best_val_f1=0.7613
Epoch 71/500  train_loss=0.476957  val_f1=0.7594  best_val_f1=0.7613
Early stopping triggered
Test F1: 0.7614
[I 2025-11-11 03:08:03,367] Trial 13 finished with value: 0.23869607843137253 and parameters: {'lr': 0.001, 'batch_size': 512, 'gcn_layers': 2, 'gcn_width_l1': 128, 'gcn_width_l2': 160, 'dropout': 0.2}. Best is trial 13 with value: 0.23869607843137253.
Epoch 1/500  train_loss=0.617975  val_f1=0.6667  best_val_f1=0.6667
Epoch 11/500  train_loss=0.524813  val_f1=0.7221  best_val_f1=0.7221
Epoch 21/500  train_loss=0.513558  val_f1=0.7261  best_val_f1=0.7267
Epoch 31/500  train_loss=0.507799  val_f1=0.7237  best_val_f1=0.7289
Epoch 41/500  train_loss=0.502968  val_f1=0.7314  best_val_f1=0.7314
Epoch 51/500  train_loss=0.500716  val_f1=0.7283  best_val_f1=0.7332
Epoch 61/500  train_loss=0.498365  val_f1=0.7323  best_val_f1=0.7361
Epoch 71/500  train_loss=0.496007  val_f1=0.7342  best_val_f1=0.7361
Epoch 81/500  train_loss=0.494477  val_f1=0.7321  best_val_f1=0.7386
Epoch 91/500  train_loss=0.492658  val_f1=0.7365  best_val_f1=0.7386
Epoch 101/500  train_loss=0.491175  val_f1=0.7357  best_val_f1=0.7390
Epoch 111/500  train_loss=0.490045  val_f1=0.7375  best_val_f1=0.7390
Early stopping triggered
Test F1: 0.7410
[I 2025-11-11 03:29:11,361] Trial 14 finished with value: 0.2609656862745098 and parameters: {'lr': 0.001, 'batch_size': 256, 'gcn_layers': 4, 'gcn_width_l1': 128, 'gcn_width_l2': 160, 'gcn_width_l3': 224, 'gcn_width_l4': 64, 'dropout': 0.2}. Best is trial 13 with value: 0.23869607843137253.
Epoch 1/500  train_loss=0.644958  val_f1=0.6224  best_val_f1=0.6224
Epoch 11/500  train_loss=0.550610  val_f1=0.7062  best_val_f1=0.7062
Epoch 21/500  train_loss=0.541823  val_f1=0.7129  best_val_f1=0.7158
Epoch 31/500  train_loss=0.536942  val_f1=0.7182  best_val_f1=0.7241
Epoch 41/500  train_loss=0.534618  val_f1=0.7246  best_val_f1=0.7246
Epoch 51/500  train_loss=0.531733  val_f1=0.7255  best_val_f1=0.7283
Epoch 61/500  train_loss=0.529790  val_f1=0.7307  best_val_f1=0.7310
Epoch 71/500  train_loss=0.527618  val_f1=0.7299  best_val_f1=0.7325
Epoch 81/500  train_loss=0.525953  val_f1=0.7321  best_val_f1=0.7338
Epoch 91/500  train_loss=0.525182  val_f1=0.7348  best_val_f1=0.7348
Epoch 101/500  train_loss=0.523589  val_f1=0.7321  best_val_f1=0.7361
Epoch 111/500  train_loss=0.522305  val_f1=0.7344  best_val_f1=0.7361
Early stopping triggered
Test F1: 0.7377
[I 2025-11-11 03:46:57,264] Trial 15 finished with value: 0.26393627450980395 and parameters: {'lr': 0.001, 'batch_size': 512, 'gcn_layers': 3, 'gcn_width_l1': 128, 'gcn_width_l2': 160, 'gcn_width_l3': 192, 'dropout': 0.4}. Best is trial 13 with value: 0.23869607843137253.
Epoch 1/500  train_loss=0.630111  val_f1=0.6499  best_val_f1=0.6499
Epoch 11/500  train_loss=0.559978  val_f1=0.6861  best_val_f1=0.6874
Epoch 21/500  train_loss=0.557488  val_f1=0.6893  best_val_f1=0.6909
Epoch 31/500  train_loss=0.555642  val_f1=0.6813  best_val_f1=0.6923
Epoch 41/500  train_loss=0.555240  val_f1=0.6802  best_val_f1=0.6923
Early stopping triggered
Test F1: 0.6935
[I 2025-11-11 03:54:27,040] Trial 16 finished with value: 0.30774999999999997 and parameters: {'lr': 0.01, 'batch_size': 512, 'gcn_layers': 2, 'gcn_width_l1': 224, 'gcn_width_l2': 160, 'dropout': 0.2}. Best is trial 13 with value: 0.23869607843137253.
Epoch 1/500  train_loss=0.607753  val_f1=0.6693  best_val_f1=0.6693
Epoch 11/500  train_loss=0.511288  val_f1=0.7361  best_val_f1=0.7361
Epoch 21/500  train_loss=0.499395  val_f1=0.7383  best_val_f1=0.7423
Epoch 31/500  train_loss=0.492174  val_f1=0.7493  best_val_f1=0.7497
Epoch 41/500  train_loss=0.487728  val_f1=0.7480  best_val_f1=0.7528
Epoch 51/500  train_loss=0.484136  val_f1=0.7541  best_val_f1=0.7545
Epoch 61/500  train_loss=0.481767  val_f1=0.7526  best_val_f1=0.7567
Epoch 71/500  train_loss=0.479019  val_f1=0.7569  best_val_f1=0.7587
Epoch 81/500  train_loss=0.477520  val_f1=0.7577  best_val_f1=0.7593
Epoch 91/500  train_loss=0.475780  val_f1=0.7617  best_val_f1=0.7617
Epoch 101/500  train_loss=0.474439  val_f1=0.7552  best_val_f1=0.7617
Epoch 111/500  train_loss=0.472575  val_f1=0.7581  best_val_f1=0.7617
Early stopping triggered
Test F1: 0.7626
[I 2025-11-11 04:10:59,704] Trial 17 finished with value: 0.23831372549019603 and parameters: {'lr': 0.001, 'batch_size': 512, 'gcn_layers': 2, 'gcn_width_l1': 160, 'gcn_width_l2': 96, 'dropout': 0.2}. Best is trial 17 with value: 0.23831372549019603.
Epoch 1/500  train_loss=0.640646  val_f1=0.6515  best_val_f1=0.6515
Epoch 11/500  train_loss=0.564392  val_f1=0.6883  best_val_f1=0.6883
Epoch 21/500  train_loss=0.556069  val_f1=0.6963  best_val_f1=0.6963
Epoch 31/500  train_loss=0.551639  val_f1=0.7042  best_val_f1=0.7071
Epoch 41/500  train_loss=0.548171  val_f1=0.7026  best_val_f1=0.7085
Epoch 51/500  train_loss=0.546213  val_f1=0.7090  best_val_f1=0.7100
Epoch 61/500  train_loss=0.545256  val_f1=0.7110  best_val_f1=0.7146
Epoch 71/500  train_loss=0.543975  val_f1=0.7085  best_val_f1=0.7146
Epoch 81/500  train_loss=0.542367  val_f1=0.7100  best_val_f1=0.7166
Epoch 91/500  train_loss=0.541939  val_f1=0.7095  best_val_f1=0.7166
Early stopping triggered
Test F1: 0.7172
[I 2025-11-11 04:28:39,805] Trial 18 finished with value: 0.2834411764705882 and parameters: {'lr': 0.001, 'batch_size': 256, 'gcn_layers': 4, 'gcn_width_l1': 160, 'gcn_width_l2': 96, 'gcn_width_l3': 224, 'gcn_width_l4': 192, 'dropout': 0.4}. Best is trial 17 with value: 0.23831372549019603.
Epoch 1/500  train_loss=0.671082  val_f1=0.5774  best_val_f1=0.5774
Epoch 11/500  train_loss=0.671825  val_f1=0.5507  best_val_f1=0.5885
Epoch 21/500  train_loss=0.692530  val_f1=0.5091  best_val_f1=0.5885
Early stopping triggered
Test F1: 0.5868
[I 2025-11-11 04:37:42,793] Trial 19 finished with value: 0.41146078431372546 and parameters: {'lr': 0.01, 'batch_size': 64, 'gcn_layers': 3, 'gcn_width_l1': 160, 'gcn_width_l2': 96, 'gcn_width_l3': 160, 'dropout': 0.3}. Best is trial 17 with value: 0.23831372549019603.
2025-11-11 04:37:42,794 | INFO | Best trial: 17
2025-11-11 04:37:42,794 | INFO | Best value: 0.23831372549019603
2025-11-11 04:37:42,794 | INFO | Best params: {'lr': 0.001, 'batch_size': 512, 'gcn_layers': 2, 'gcn_width_l1': 160, 'gcn_width_l2': 96, 'dropout': 0.2}
Epoch 1/500  train_loss=0.582726  val_f1=0.6882  best_val_f1=0.6882
Epoch 11/500  train_loss=0.528007  val_f1=0.7156  best_val_f1=0.7209
Epoch 21/500  train_loss=0.522773  val_f1=0.7235  best_val_f1=0.7260
Epoch 31/500  train_loss=0.519685  val_f1=0.7237  best_val_f1=0.7289
Epoch 41/500  train_loss=0.517913  val_f1=0.7238  best_val_f1=0.7295
Epoch 51/500  train_loss=0.516735  val_f1=0.7259  best_val_f1=0.7295
Epoch 61/500  train_loss=0.515855  val_f1=0.7277  best_val_f1=0.7306
Epoch 71/500  train_loss=0.515436  val_f1=0.7187  best_val_f1=0.7306
Early stopping triggered
Test F1: 0.7314
2025-11-11 05:03:16,226 | INFO | Saved best model to model/case30_baseline_gcn.pth
2025-11-11 05:03:16,226 | INFO | Logs written to logs/gcn_run.log
